{
  "chosen_action": "move_right",
  "action_scores": {
    "move_left": 0.05,
    "stay": 0.1,
    "move_right": 0.85
  },
  "questions": [
    {
      "id": "q_safest_lane",
      "text": "Which lane has a clear path?",
      "options": ["Lane 1", "Lane 2", "Lane 3"]
    }
  ],
  "question_set": "perception_direct_v1",
  "latency_ms": 28.4,
  "reason": "Laya identified Lane 2 as having an open path with 85% probability, mapping to move_right.",
  "raw": {
    "probabilities": [0.05, 0.85, 0.1],
    "predicted_token": "Lane 2"
  }
}
